{
  "authorization_id": null,
  "candidate_id": null,
  "candidate_relation_valid": true,
  "candidate_scalar": 1,
  "checks": [
    {
      "check_id": "candidate_relation_v1",
      "detail": "Independent affine oracle recomputed [k]G=Q.",
      "status": "passed"
    },
    {
      "check_id": "provenance_binding_v1",
      "detail": "All producer and validator inputs are digest-bound.",
      "status": "passed"
    }
  ],
  "contract_kind": "validation_receipt_v1",
  "framework_authorization_class": "fixture",
  "hypothesis_id": null,
  "independent_implementation": true,
  "internal_classification": "engineering_only",
  "native_research_outcome": false,
  "passed": true,
  "private_target_receipt_sha256": "90e941d2c14c4d2be5bb5dfcc48a7103be5177b029c638b8c0c782018d7038f4",
  "producer_implementation_sha256": "2222222222222222222222222222222222222222222222222222222222222222",
  "provenance": {
    "config_sha256": "536a86cc289e5e296afe69aea548cb317b50e0af6e17a61419bb3f02b6799bff",
    "diff_sha256": null,
    "producer_dependency_sha256s": ["2222222222222222222222222222222222222222222222222222222222222222"],
    "source_commit": "0123456789abcdef0123456789abcdef01234567",
    "source_snapshot_sha256": "1111111111111111111111111111111111111111111111111111111111111111",
    "source_tree_clean": true,
    "validator_dependency_sha256s": ["3333333333333333333333333333333333333333333333333333333333333333"]
  },
  "provenance_valid": true,
  "record_kind": "lab_engineering_fixture",
  "retainable": false,
  "retention_class": "engineering_only",
  "retention_decision": "development_only",
  "route_effect": "none",
  "schema_version": 1,
  "shares_decisive_logic": false,
  "subject_contract_kind": "method_result_v1",
  "subject_id": "6666666666666666666666666666666666666666666666666666666666666666",
  "subject_sha256": "42ade5d55ee1127197297b57ab315681174fba6f975c810dc0d52426838451df",
  "validation_id": "8888888888888888888888888888888888888888888888888888888888888888",
  "validator_id": "lab_ec_oracle_v1",
  "validator_implementation_sha256": "3333333333333333333333333333333333333333333333333333333333333333",
  "validator_output_sha256": "aaaaaaaaaaaaaaaaaaaaaaaaaaaaaaaaaaaaaaaaaaaaaaaaaaaaaaaaaaaaaaaa",
  "validator_request_sha256": "9999999999999999999999999999999999999999999999999999999999999999"
}
